{
  "schema_version": "0.1.0",
  "session_id": "fictional-session-001",
  "subject_local_id": "fictional-subject",
  "protocol_id": "depth-v0",
  "mode": "voice",
  "started_at": "2000-01-01T10:00:00Z",
  "ended_at": "2000-01-01T10:35:00Z",
  "selected_lenses": [
    "work-creation"
  ],
  "orientation_refs": [
    {
      "registry_id": "personal-strivings",
      "form": "fictional six-striving elicitation",
      "language": "en",
      "administration_mode": "conversation",
      "registry_admission": "admitted",
      "completed_at": "2000-01-01T09:30:00Z",
      "result_locator": "vault://fictional/instruments/strivings-001",
      "interpretation_purpose": "Select one fictional work-goal tension for episode-based inquiry."
    }
  ],
  "consent": {
    "capture": [
      "audio"
    ],
    "retained_artifacts": [
      "transcript",
      "instrument-results",
      "evidence",
      "claims"
    ],
    "downstream_access": "none",
    "confirmed_at": "2000-01-01T09:59:00Z",
    "renewed_at_close": "2000-01-01T10:35:00Z"
  },
  "artifact_refs": [
    {
      "kind": "instrument-result",
      "locator": "vault://fictional/instruments/strivings-001",
      "digest": "sha256:fictional-instrument-fixture-not-a-real-digest"
    },
    {
      "kind": "transcript",
      "locator": "vault://fictional/transcripts/session-001",
      "digest": "sha256:fictional-fixture-not-a-real-digest"
    }
  ],
  "review_state": "awaiting-review",
  "notes": "Fictional schema fixture; contains no interview with a real person."
}
